{
  "$schema": "https://veritymodchecker.online/data/verity-app-claims.schema.json",
  "schemaVersion": 1,
  "checkedAt": "2026-07-30T20:05:00+08:00",
  "canonicalUrl": "https://veritymodchecker.online/apk/",
  "method": "Manual comparison against public Google Play listing text and current maintainer MCADDON route records. App listing facts are point-in-time store disclosures, not malware verdicts and not official-project proof.",
  "normalMinecraftPackageRoutes": [
    {
      "name": "Verity BE",
      "projectId": 1574632,
      "recordId": 8583159,
      "packageType": "mcaddon",
      "url": "https://www.curseforge.com/minecraft-bedrock/addons/verity-be/files/8583159"
    },
    {
      "name": "Verity - Bedrock Edition by PnTMC",
      "projectId": 1575941,
      "recordId": 8517480,
      "packageType": "mcaddon",
      "url": "https://www.curseforge.com/minecraft-bedrock/addons/verity-bedrock-edition/files/8517480"
    },
    {
      "name": "Verity Pocket Edition (Be)",
      "projectId": 1596246,
      "recordId": 8406293,
      "packageType": "mcaddon",
      "url": "https://www.curseforge.com/minecraft-bedrock/addons/verity-pocket-edition-be/files/8406293"
    }
  ],
  "googlePlayListings": [
    {
      "title": "Verity Mods for Minecraft",
      "publisher": "BirchApps",
      "packageId": "com.verity.stalker.mobs.birchappsmcpe",
      "url": "https://play.google.com/store/apps/details?id=com.verity.stalker.mobs.birchappsmcpe",
      "installSignal": "500K+ downloads",
      "ratingSignal": "3.5 stars and 2.78K reviews observed at check",
      "updated": "2026-07-23",
      "monetization": [
        "contains ads"
      ],
      "relationshipStatus": "third-party app claim unless an official Verity project page links to it",
      "listingSignals": [
        "disclaimer says it is not affiliated with Mojang, Microsoft, Verity creators, or related rights holders",
        "data safety disclosures mention shared and collected data: Location, App activity, and 2 others",
        "data is encrypted in transit but cannot be deleted"
      ]
    },
    {
      "title": "Verity Mod for Minecraft PE",
      "publisher": "GO:KU STUDIO",
      "packageId": "com.goku.verity.horror",
      "url": "https://play.google.com/store/apps/details?id=com.goku.verity.horror",
      "installSignal": "0+ downloads",
      "updated": "2026-07-28",
      "monetization": [
        "contains ads"
      ],
      "relationshipStatus": "third-party app claim unless an official Verity project page links to it",
      "listingSignals": [
        "describes itself as a content browser for community-made add-ons",
        "says it is not affiliated with Mojang, Microsoft, or Minecraft",
        "data-safety panel says Location, Personal info, and 4 other data types may be shared and collected",
        "data is not encrypted and cannot be deleted"
      ]
    },
    {
      "title": "Verity Mod for Minecraft PE",
      "publisher": "I13",
      "packageId": "com.l13devstudio.verit",
      "url": "https://play.google.com/store/apps/details?id=com.l13devstudio.verit",
      "installSignal": "500K+ downloads",
      "ratingSignal": "4.5 stars and 30.7K reviews observed at check",
      "updated": "2026-07-17",
      "monetization": [
        "contains ads"
      ],
      "relationshipStatus": "third-party app claim unless an official Verity project page links to it",
      "listingSignals": [
        "disclaimer says it is an unofficial app not associated with Mojang or Microsoft",
        "data-safety panel says no data is shared with third parties and no data is collected"
      ]
    },
    {
      "title": "Verity Mod for Minecraft PE",
      "publisher": "Real Games Villa",
      "packageId": "verity.mod.minecraft.pemodverity",
      "url": "https://play.google.com/store/apps/details?id=verity.mod.minecraft.pemodverity",
      "installSignal": "10K+ downloads",
      "updated": "2026-07-17",
      "monetization": [
        "contains ads"
      ],
      "relationshipStatus": "third-party app claim unless an official Verity project page links to it",
      "listingSignals": [
        "says it is not an official Minecraft product and is not approved by or associated with Mojang or Microsoft",
        "data-safety panel says no data is shared or collected",
        "data-safety panel says data is not encrypted"
      ]
    },
    {
      "title": "Verity Mod for Minecraft PE",
      "publisher": "richard7",
      "packageId": "com.richmcpe.verity",
      "url": "https://play.google.com/store/apps/details?id=com.richmcpe.verity",
      "installSignal": "100K+ downloads",
      "ratingSignal": "4.6 stars and 1.28K reviews observed at check",
      "updated": "2026-07-05",
      "monetization": [
        "contains ads"
      ],
      "relationshipStatus": "third-party app claim unless an official Verity project page links to it",
      "listingSignals": [
        "says it is not approved by or associated with Mojang or Microsoft",
        "data-safety panel says device or other IDs may be shared with third parties",
        "data can be encrypted in transit but cannot be deleted",
        "visible reviews include users saying the mods did not work after ads or pack activation"
      ]
    },
    {
      "title": "Verity Mod for Minecraft PE",
      "publisher": "IAAMAR EL WAHA",
      "packageId": "com.backroomsnextbots.sphermeme",
      "url": "https://play.google.com/store/apps/details?id=com.backroomsnextbots.sphermeme",
      "installSignal": "50K+ downloads",
      "ratingSignal": "1.6 stars and 110 reviews observed at check",
      "updated": "2026-07-22",
      "monetization": [
        "contains ads"
      ],
      "relationshipStatus": "third-party app claim unless an official Verity project page links to it",
      "listingSignals": [
        "listing is categorized as a game and describes add-ons, maps, skins, textures, and resources",
        "visible reviews say the experience was not like the mod, Verity was not found, or the entity did not spawn",
        "data-safety panel says Location and Device or other IDs may be shared, no data is collected, data is encrypted in transit, and data cannot be deleted"
      ]
    },
    {
      "title": "Verity Mod",
      "publisher": "SAR13",
      "packageId": "com.sar.verity.art",
      "url": "https://play.google.com/store/apps/details?id=com.sar.verity.art",
      "installSignal": "0+ downloads",
      "ratingSignal": "3.4 stars and 70 reviews observed at check",
      "updated": "2026-07-24",
      "monetization": [
        "contains ads"
      ],
      "relationshipStatus": "third-party app claim unless an official Verity project page links to it",
      "listingSignals": [
        "description frames the app as a horror mods hub with Verity and other Minecraft PE content",
        "says it is not an official Minecraft product and is not approved by or associated with Mojang or Microsoft",
        "data-safety panel says Location, App info and performance, and Device or other IDs may be shared and collected",
        "data is not encrypted and cannot be deleted"
      ]
    },
    {
      "title": "Verity Mod for Minecraft PE",
      "publisher": "APP SYSTEM PIOTR MOSTOWSKI",
      "packageId": "com.appsystemdev.verity",
      "url": "https://play.google.com/store/apps/details?id=com.appsystemdev.verity",
      "installSignal": "0+ downloads",
      "ratingSignal": "4.5 stars and 251 reviews observed at check",
      "updated": "2026-07-27",
      "monetization": [
        "contains ads"
      ],
      "relationshipStatus": "third-party app claim unless an official Verity project page links to it",
      "listingSignals": [
        "description says it is a collection of horror mods and addons built around Verity, Falsity, Cruelity, Lovity, and other hunters",
        "disclaimer says it is an unofficial Minecraft Pocket Edition application not associated with Mojang or supported by Mojang",
        "data-safety panel says no data is shared and no data is collected",
        "data is encrypted in transit but cannot be deleted",
        "visible reviews include users saying ads are present, mods did not work, or installation failed"
      ]
    },
    {
      "title": "Verity Mods for Minecraft PE",
      "publisher": "Stratovia Consulting LLC",
      "packageId": "com.stratoviac.verity.mods.minecraft",
      "url": "https://play.google.com/store/apps/details?id=com.stratoviac.verity.mods.minecraft",
      "installSignal": "50K+ downloads",
      "ratingSignal": "4.8 stars and 1.94K reviews observed at check",
      "updated": "2026-07-28",
      "monetization": [
        "contains ads"
      ],
      "relationshipStatus": "third-party app claim unless an official Verity project page links to it",
      "listingSignals": [
        "description says it is a utility to discover, manage, and install compatible community-created content",
        "disclaimer says it is not affiliated with Mojang, Microsoft, the creators of Verity, or other rights holders",
        "data-safety panel says Location, App activity, and two other data types may be shared",
        "data-safety panel says no data is collected and data is encrypted in transit",
        "visible reviews include users saying there were no add-ons or maps and another review calling it fanmade Verity"
      ]
    },
    {
      "title": "Verity Mod for Minecraft PE",
      "publisher": "LasoStudio",
      "packageId": "com.verity.modeveritteryaretewe",
      "url": "https://play.google.com/store/apps/details?id=com.verity.modeveritteryaretewe",
      "installSignal": "10K+ downloads",
      "updated": "2026-07-17",
      "monetization": [
        "contains ads"
      ],
      "relationshipStatus": "third-party app claim unless an official Verity project page links to it",
      "listingSignals": [
        "description frames the app as a Verity Mod for Minecraft PE discovery and one-tap installation route",